en,ru
"and she was the, uh, she was in the junior Olympics or something","и она была, э-э, она участвовала в юношеских Олимпийских играх или что-то в этом роде"
"or they seem to have people who have very, very big sports backgrounds.","или, похоже, у них есть люди с очень, очень большим спортивным прошлым."
To have,Иметь
"they, leaned away from that sort of,","они, отклонились от такого рода,"
"They hold competitions in Los Angeles in, um, Florida and Minneapolis, um,","Они проводят соревнования в Лос-Анджелесе, эм, во Флориде и Миннеаполисе, эм,"
"trying to think of,","пытаюсь думать о,"
I think it's in four places around the United States.,"Я думаю, что это в четырех местах по всей территории Соединенных Штатов."
They hold competition,Они проводят соревнование
"and the only requirement is, of course, your skill of passing these tests,","и единственное требование - это, конечно, ваше умение проходить эти тесты,"
"Oh, that's how they do it.","О, вот как они это делают."
and that's it.,и это все.
And we had a bar man from here in Dallas area that made it.,"И у нас был бармен отсюда, из Далласа, который сделал это."
Really?,Действительно?
"There is a woman that, uh, made,","Есть женщина, которая, э-э, заставила,"
"well, she called herself a craft person","ну, она называла себя мастерицей"
"so, I'm not quite sure what she made.","так что я не совсем уверен, что она приготовила."
"And, uh, she made it.","И, э-э, у нее получилось."
"I mean there is no,","Я имею в виду, что нет,"
your occupation has nothing to do with it.,ваша профессия не имеет к этому никакого отношения.
"Yeah,","Да,"
"okay,","окей,"
"I just thought they had some,","Я просто подумал, что у них есть немного,"
Strictly your skill.,Исключительно ваше мастерство.
"yeah,","да,"
"I thought they had some sort of,","Я думал, у них был какой-то,"
"I mean, I thought they were just poor people like us I guess not,","Я имею в виду, я думал, что они просто бедные люди, как и мы, но, думаю, нет,"
that's great.,это здорово.
Huh-uh.,Ха-ха.
"But, maybe I'll try it one day.","Но, может быть, однажды я попробую это сделать."
"I'll get on there one day and see if I can, uh, um,","Однажды я попаду туда и посмотрю, смогу ли я, эм, эм,"
"what, what do they win,","что, что они выигрывают,"
"they, they win money I think, don't they?","они, я думаю, они выигрывают деньги, не так ли?"
I think the last I heard was it's up to about a hundred fifty thousand dollars.,"По-моему, последнее, что я слышал, было то, что речь идет примерно о ста пятидесяти тысячах долларов."
Really?,Действительно?
Uh-huh.,Угу.
Wow.,Вау.
All that for getting tennis balls shot at you at a hundred miles an hour.,"И все это за то, что в тебя летят теннисные мячи со скоростью сто миль в час."
"Yeah,","Да,"
"that's, you know, just minor.","это, знаете ли, просто незначительно."
"Just minor little ball here or there, you know.","Просто незначительный маленький шарик здесь или там, вы знаете."
"One little ball here and there,","Один маленький шарик здесь и там,"
"yeah,","да,"
"and this guy's beating you up,","и этот парень избивает тебя,"
"so, I don't know the beating up part.","итак, я не знаю, что такое избиение."
"I, I actually feel the tennis balls would hurt.","Я, я действительно чувствую, что теннисные мячи причинили бы боль."
"Oh, well, they, they come out with a lot of bruises too.","О, ну, они, они тоже выходят с большим количеством синяков."
"They look like,","Они выглядят как,"
"Yeah,","Да,"
they seem like a tennis ball,они похожи на теннисный мячик
