en,ru
"so you're probably in a, you know,","так что вы, вероятно, находитесь в... ну, вы знаете,"
"Well, they vary, from place to place,","Что ж, они варьируются от места к месту,"
"it's hard to tell, you know, how well they've been kept up how old they are,","знаете, трудно сказать, насколько хорошо они содержались, сколько им лет,"
Uh-huh.,Угу.
"and these are probably, oh, one of the nicest that I found,","и это, наверное, о, одни из самых приятных, которые я нашел,"
"and, uh, they're almost five hundred a month for a one bedroom place.","и, э-э, они платят почти пятьсот в месяц за квартиру с одной спальней."
"Ooh that does get high,","О, это действительно кайфует,"
"yeah,","да,"
"I mean,","Я имею в виду,"
"Yeah,","Да,"
"it does, considering that, you know, uh, house payments are, not a whole lot more than that,","это так, учитывая, что, знаете ли, платежи за жилье составляют не намного больше этого,"
"Yeah,","Да,"
"I was going to say, our mortgage is, is between, depending on,","Я собирался сказать, что наша ипотека находится между, в зависимости от,"
"you know, it drops, um,","ты знаешь, это падает, эм,"
"seems like in the last six months we, um, got lucky","похоже, за последние шесть месяцев нам, эм, повезло"
"and we refinanced,","и мы рефинансировали,"
"and it,","и это,"
"but it was like eight hundred and something,","но это было около восьмисот с чем-то,"
but it went down to like seven hundred and twenty,но он снизился примерно до семисот двадцати
Yeah.,Да.
"so that's really not,","так что это на самом деле не,"
"I have friends that pay about nine hundred dollars for a town house in,","У меня есть друзья, которые платят около девятисот долларов за городской дом в,"
"Wow, that's a lot for a townhouse.","Вау, это многовато для таунхауса."
"yeah,","да,"
"in,","в,"
"actually they're near Plano in North Dallas too,","на самом деле они тоже недалеко от Плано в Северном Далласе,"
"but I couldn't believe it,","но я не мог в это поверить,"
"but, you know,","но, ты знаешь,"
"But that's what happens when you get up in this area, you know, you got all these companies are up here,","Но вот что происходит, когда вы оказываетесь в этой области, вы знаете, у вас есть все эти компании, расположенные здесь,"
and these,и эти
Yeah.,Да.
"and, I guess they know they're going to get it,","и, я думаю, они знают, что получат это,"
"And then I think that, um, nobody was really buying houses there for a long time there because of just,","И потом, я думаю, что, гм, на самом деле там долгое время никто не покупал дома из-за просто,"
"I mean, we've been in ours for about ten years,","Я имею в виду, что мы занимаемся своим уже около десяти лет,"
"but, uh there's no investment in it,","но, э-э, в это нет никаких вложений,"
"you know all it allows you to do is itemize, on your on your taxes yeah,","ты знаешь, все, что это позволяет тебе делать, это перечислять по пунктам твои налоги, да,"
Yeah.,Да.
"Yeah,","Да,"
"that's true,","это правда,"
you just take off your mortgage interest,вы просто снимаете проценты по ипотеке
"and that's about it,","и это примерно все,"
"that's really about it,","вот в этом-то все и дело,"
"it's, uh,","это, э-э,"
"have you ever owned your own home,","у вас когда-нибудь был свой собственный дом,"
"Yeah,","Да,"
"I've owned, uh, several, built several,","Я владел, э-э, несколькими, построил несколько,"
"So you know what it's like,","Так что ты знаешь, на что это похоже,"
"yeah,","да,"
"it's like, when you first,","это как, когда ты впервые,"
"this is our third one,","это наш третий,"
"it's not, um,","это не, эм,"
and it's not that exciting after a while,и через некоторое время это уже не так волнующе
"Well and especially around North Dallas, or at least in Plano area, they, they basically all look alike because Fox and Jacobs,","Ну, и особенно в окрестностях Северного Далласа, или, по крайней мере, в районе Плано, они, они в основном все похожи друг на друга, потому что Фокс и Джейкобс,"
"Yeah,","Да,"
"suburban tract,","пригородный тракт,"
"yeah,","да,"
"we, uh, we lived out of state for a while and came back","мы, э-э, мы некоторое время жили за пределами штата и вернулись"
"and, uh, we lived in a smaller city,","и, э-э, мы жили в городе поменьше,"
"and now we say, Gee, Dallas really is big and polluted","и теперь мы говорим: ну и дела, Даллас действительно большой и загрязненный"
Isn't it.,Не так ли?
"I can remember,","Я могу вспомнить,"
"I've only been here eight years,","Я здесь всего восемь лет,"
"but I can remember coming to work from,","но я помню, как приходил на работу из,"
I used to live in Wylie,Раньше я жил в Уайли
Uh-huh.,Угу.
"and I could see downtown Dallas,","и я мог видеть центр Далласа,"
"and now there's this brown haze over it,","и теперь над ним эта коричневая дымка,"
and it's moving north.,и он движется на север.
"Yeah,","Да,"
"it's really it's really sad because they're not doing anything,","это действительно это действительно печально потому что они ничего не делают,"
"well we're getting off the subject, I guess,","ну, я думаю, мы уходим от темы,"
"but just like with housing, I mean, they're not doing anything about pollution,","но точно так же, как и в случае с жильем, я имею в виду, что они ничего не делают с загрязнением окружающей среды,"
"they're not doing anything about,","они ничего не делают по поводу,"
"it's going to look like,","это будет выглядеть так,"
have you ever been to Houston?,вы когда-нибудь были в Хьюстоне?
"Oh, yeah.","О, да."
"You know, um, I used to think that Dallas was better than Houston because their zoning for where you can put a house next to a,","Знаешь, эм, раньше я думал, что Даллас лучше Хьюстона, потому что у них такое зонирование, где можно поставить дом рядом с,"
"Yeah,","Да,"
now it looks just like Houston to me.,"теперь, по-моему, это выглядит точь-в-точь как Хьюстон."
"Yeah,","Да,"
it does.,Оно делает.
How long have you been in this house?,Как давно ты живешь в этом доме?
We've been in here ten years.,Мы здесь уже десять лет.
Ten years.,Десять лет.
"Yeah,","Да,"
"so we've got, you know, got some investment in it,","так что у нас есть, вы знаете, кое-какие инвестиции в это,"
"but, you really don't get anything out of it.",но на самом деле вы ничего от этого не получите.
"No,","Нет,"
you really don't.,ты действительно этого не делаешь.
"Were, you said you were out of state for a while, was that a smaller town than Dallas area.","Были, вы сказали, что какое-то время находились за пределами штата, это был город поменьше, чем район Далласа."
"Yeah,","Да,"
"smaller,","меньше,"
"we were up in Pittsburgh, Pennsylvania.","мы были в Питтсбурге, штат Пенсильвания."
How was it,Как это было
My home town.,Мой родной город.
how were the house prices up there?,как там были цены на жилье?
"The prices, actually, a lot better, because Pittsburgh is about the size, I've been trying to think, like a Louisville, or Minneapolis, that type of size.","Цены, на самом деле, намного лучше, потому что Питтсбург примерно такого размера, я пытался представить, как Луисвилл или Миннеаполис, такого типа."
Yeah.,Да.
"And the prices, what you get here for about a hundred thousand you could get there for about seventy-five, eighty.","И цены, то, что вы получаете здесь примерно за сто тысяч, вы могли бы получить там примерно за семьдесят пять, восемьдесят."
Wow.,Вау.
"Yeah,","Да,"
"it's really,","это действительно,"
"and we didn't think it was that clean,","и мы не думали, что здесь настолько чисто,"
"but then after you're gone for a while, it looks cleaner, you know","но потом, когда ты уезжаешь на некоторое время, все выглядит чище, знаешь"
"Oh, yeah","О, да"
"uh,","ух,"
"well, you know, a lot of these people that I've talked to that are coming down from, uh, like what I call, the back East especially from J C Penney, uh, are selling two and three hundred thousand dollar houses up there and buying a hundred and fifty, hundred and seventy-five thousand dollar houses down here,","ну, вы знаете, многие из тех людей, с которыми я разговаривал, которые приезжают, э-э, как я это называю, с дальнего Востока, особенно из Джей Си Пенни, э-э, продают там дома за двести и триста тысяч долларов и покупают сто пятьдесят, сто семьдесят- дома за пять тысяч долларов здесь внизу,"
"Yeah,","Да,"
and they've wound up getting better houses here than they had there,"и в итоге они получили здесь дома получше, чем были там"
"so in a way, I guess it works both ways.","так что в некотором смысле, я думаю, это работает в обоих направлениях."
"I guess it's,","Я думаю, это,"
"yeah,","да,"
"but, and here I guess it depends on what you want,","но, и здесь, я думаю, это зависит от того, чего вы хотите,"
"you know, here, I got a lot of people that work for J C Penney in marketing","вы знаете, здесь у меня много людей, которые работают на Джей Си Пенни в отделе маркетинга"
Yeah.,Да.
"and a lot of the people that came from that area, probably like what you're talking about, they had no, um, they had a lot of property but not a lot of house,","и многим людям, которые приехали из того района, вероятно, нравится то, о чем вы говорите, у них не было, эм, у них было много собственности, но не так много домов,"
and now they have a lot of house and hardly any yardage around it,и теперь у них много дома и почти нет дворов вокруг него
"That's a fact,","Это факт,"
"but, but they love it.","но, но им это нравится."
"I mean, they, they, they think they're getting,","Я имею в виду, они, они, они думают, что получают,"
"you know, you say, sun room to them, and you enclose and you can sell it","вы знаете, вы говорите им ""солнечная комната"", и вы прилагаете ее, и вы можете продать ее"
I guess that's true.,"Я думаю, это правда."
Yeah.,Да.
And they don't have to worry about yard upkeep if they don't hardly have any.,"И им не нужно беспокоиться о содержании двора, если у них его почти нет."
"Yeah,","Да,"
"and a lot of them I know, a couple women that work there,","и многих из них я знаю, пару женщин, которые там работают,"
"and they don't miss, in Public Relations,","и они не промахиваются в области связей с общественностью,"
"and they don't miss having a basement to run up and down to, you know,","и они не скучают по тому, что у них есть подвал, куда можно бегать вверх-вниз, вы знаете,"
"That's true,","Это правда,"
there's not too many basements in Texas.,в Техасе не так уж много подвалов.
"And I said, You haven't heard about tornados","И я сказал, вы не слышали о торнадо"
"How about those, you know,","Как насчет этих, ты знаешь,"
"Yeah,","Да,"
"gosh I remember when I was little, uh, we didn't have a,","черт возьми, я помню, когда я был маленьким, у нас не было,"
"I lived, grew up in southern Oklahoma",Я жил и вырос в южной Оклахоме
Uh-huh.,Угу.
"and, uh, people across the street had a cellar,","и, э-э, у людей через дорогу был подвал,"
"and we never did,","и мы никогда этого не делали,"
"and it's just like Dallas area, it was tornado alley up there,","и это точно так же, как район Далласа, там была аллея торнадо,"
"and every spring mom would drag me up at three o'clock, four o'clock in the morning and pajamas and teddy bear across the street,","и каждую весну мама поднимала меня в три-четыре часа утра в пижаме и с плюшевым мишкой через улицу,"
"and we'd go into the cellar,","и мы спускались в подвал,"
"and I to this day, I don't care if I go or not,","и мне по сей день все равно, пойду я или нет,"
Yep.,Ага.
"you know, if it's going to get me, it's get me.","ты знаешь, если это собирается достать меня, то это достанет меня."
"That's exactly, uh,","Это точно, э-э-э,"
"growing,","растущий,"
"I grew up in western Pennsylvania, near Pittsburgh,","Я вырос в западной Пенсильвании, недалеко от Питтсбурга,"
"and, uh, we used to call the basements actual cellars,","и, э-э, мы привыкли называть подвалы настоящими погребами,"
"so it's funny to hear that word, because I never hear it,","так что забавно слышать это слово, потому что я никогда его не слышу,"
"you know, it's like the back porch used to be a stoop, you know","знаешь, это как будто заднее крыльцо раньше было крыльцом, понимаешь"
Yeah.,Да.
"but, uh, um, the housing is just,","но, э-э-э, жилье просто,"
"we like the older houses,","нам нравятся старые дома,"
"and I don't know if we're going to stay here or not, depends,","и я не знаю, собираемся ли мы остаться здесь или нет, зависит,"
"you know, I mean,","ты знаешь, я имею в виду,"
You ever thought about building a house?,"Вы когда-нибудь думали о том, чтобы построить дом?"
Pardon me?,Простите меня?
Have you ever thought about building a house?,"Вы когда-нибудь думали о том, чтобы построить дом?"
"Yeah,","Да,"
"actually when we were up north, um,","вообще-то, когда мы были на севере, эм,"
but some family things changed,но кое-что в семье изменилось
"so we ended up come back down here, and all that, because it helped my husband's work,","так что в итоге мы вернулись сюда, и все такое, потому что это помогло работе моего мужа,"
"but, um, we really would like to,","но, эм, мы действительно хотели бы,"
"but we don't know if we're going to do it unless we stay here, you know.","но мы не знаем, сможем ли мы это сделать, если не останемся здесь, вы знаете."
"Yeah,","Да,"
"that's true,","это правда,"
"especially when,","особенно, когда,"
"with T I it's like anybody else, you never know how long you're going to be here, be in one place, you know,","с T I все как с любым другим, ты никогда не знаешь, как долго ты пробудешь здесь, будешь на одном месте, понимаешь,"
"Yeah,","Да,"
"it's real tough,","это действительно тяжело,"
"I mean, the economy any more,","Я имею в виду, экономика больше не,"
"I mean, I think everybody just lives under an umbrella, the uncertainty with housing and everything,","Я имею в виду, я думаю, что все просто живут под зонтиком, неопределенность с жильем и все такое,"
Yeah.,Да.
"you know, it's,","ты знаешь, это,"
Do you work?,Вы работаете?
Pardon me?,Простите меня?
Do you work?,Вы работаете?
"Yes,","Да,"
I do.,Я делаю.
"Well, how do you handle,","Ну, и как ты справляешься,"
do you have kids?,у вас есть дети?
"No,","Нет,"
we don't.,мы не.
"So you got,","Итак, у вас есть,"
"he's working and working to get this big house to take care of,","он работает и работает над тем, чтобы позаботиться об этом большом доме,"
how do you manage both of those?,как вы справляетесь с тем и другим?
"Uh, how do we take care of the house.","Э-э, как нам позаботиться о доме?"
"Well, I don't have a","Ну, у меня нет"
"I don't, shouldn't say that,","Я не, не должен был этого говорить,"
I don't have an ethnic maid,У меня нет горничной по национальности
Yeah.,Да.
"I don't have,","У меня нет,"
"we have some friends that live near North Dallas off of Campbell Road,","у нас есть несколько друзей, которые живут недалеко от Северного Далласа, недалеко от Кэмпбелл-роуд,"
"and they have like a four thousand square foot home,","и у них есть дом площадью около четырех тысяч квадратных футов,"
"and she's got a, uh, a live out nanny. Um,","и у нее есть, э-э, постоянная няня. Хм,"
"but any rate, I don't have any of that, um,","но в любом случае, у меня нет ничего из этого, эм,"
"I don't know,","Я не знаю,"
"it's really not too difficult with no children and just two people, you know.","знаете, это действительно не так уж сложно, когда нет детей и всего два человека."
"You basically can take care of everything yourself,","В принципе, вы можете позаботиться обо всем сами,"
"We have a,","У нас есть,"
"Yeah,","Да,"
"we have a dog,","у нас есть собака,"
"and we're pretty,","и мы хорошенькие,"
"I mean, we're not fanatically neat,","Я имею в виду, что мы не фанатично аккуратны,"
"but, um, we keep things up, you know not like where there is three feet of weeds or anything in the yard by the time you need to, um, get around to fertilizing and cutting in the spring.","но, гм, мы продолжаем в том же духе, знаете, не то что там, где во дворе вырастает три фута сорняков или чего-то еще к тому времени, когда вам нужно, гм, заняться удобрениями и обрезкой весной."
"Yeah,","Да,"
Yeah.,Да.
"What about home repairs and stuff,","А как насчет домашнего ремонта и прочего,"
"do you have to do all that yourself,","тебе обязательно делать все это самому,"
"or,","или,"
"Um, no,","Эм, нет,"
"we're pretty much, um,","мы в значительной степени, эм,"
"we, we've been around long enough as a couple that we learned a long time ago not to wall paper together and things like that.","мы, мы достаточно долго были парой, чтобы давным-давно научиться не клеить обои вместе и тому подобное."
"Oh, you too.","О, и ты тоже."
"Uh, we pretty much hire,","Э-э, мы в значительной степени нанимаем,"
"we subcontract mostly everything I mean other than anything that's not a, um,","мы заключаем субподряды в основном на все, что я имею в виду, кроме всего, что не является, эм,"
Yeah.,Да.
"I mean, I know how to fix a running toilet","Я имею в виду, я знаю, как починить работающий унитаз"
"Oh, yeah.","О, да."
"he does what he needs to,","он делает то, что ему нужно,"
"but mostly if it's something major, um, you know, cleaning out the air conditioning ducts or something like that, we just hire out to do that,","но в основном, если это что-то серьезное, ну, вы знаете, чистка воздуховодов кондиционера или что-то в этом роде, мы просто нанимаем для этого,"
"Sounds like you've already got the makings for being a general contractor,","Похоже, у вас уже есть задатки для того, чтобы стать генеральным подрядчиком,"
"Yeah,","Да,"
"no thanks,","нет, спасибо,"
"I,","Я,"
"If you don't wall paper it well together, you should probably not build a house together.","Если вы плохо оклеите их обоями, вам, вероятно, не стоит строить дом вместе."
"Have you ever done that,","Ты когда-нибудь делал это,"
"Yeah,","Да,"
I built three houses in my life,За свою жизнь я построил три дома
And how'd that go?,И как все прошло?
the building process was a lot of fun,процесс строительства был очень увлекательным
Uh-huh.,Угу.
but puts a lot of strain on things.,но это сильно напрягает ситуацию.
"Getting to agree to things, I'm sure,","Начинаю с чем-то соглашаться, я уверен,"
"and I also think that once you get to be, um, you know, certain,","и я также думаю, что как только ты станешь, эм, ну знаешь, уверенным,"
"when you get to be thirty something and thirty something gets to be a little bit older you start, um,","когда тебе исполняется тридцать с чем-то, а тридцать с чем-то становятся немного старше, ты начинаешь, эм,"
Yeah.,Да.
"the dollar value on things I,","долларовая стоимость вещей, которые я,"
You bet.,Вы ставите.
