en,ru
who can some up each starsign with one positive one negative typical stereotype?,кто может дополнить каждый звездный знак одним положительным или одним отрицательным типичным стереотипом?
Are Bulldogs supporters going to  celebrate Barry Hall's move with  a glass of punch?,"Собираются ли болельщики ""Бульдогс"" отпраздновать переход Барри Холла бокалом пунша?"
"Ladies, what strain or type of bud do you like to smoke the most?","Дамы, какой сорт или разновидность бутона вам нравится курить больше всего?"
How long does it take for an nds rom to upload onto the internet?,Сколько времени требуется для загрузки ПЗУ nds в Интернет?
What does Sim not provisioned MM #2 mean for a cellphone?,Что означает неподготовленная SIM-карта MM #2 для мобильного телефона?
Did you hear about my buddy Bill Fold?,Ты слышал о моем приятеле Билле Фолде?
What was the role of the Church and Papacy during the Early Middle Ages?,Какова была роль Церкви и папства в раннем Средневековье?
Do cinemas still update their listings on a Wednesday/Thursday in England?,Кинотеатры в Англии по-прежнему обновляют свои объявления по средам/четвергам?
"A weird, but good dream?","Странный, но хороший сон?"
What version of the Bible do you use and why?,Какую версию Библии вы используете и почему?
What was it about the 1976 Flu vaccine that triggered Guillian-Barre Syndrome?  Has that flaw been corrected?,"Что такого было в вакцине против гриппа 1976 года, которая вызвала синдром Гийана-Барре?  Был ли исправлен этот недостаток?"
fighting with my boyfriend but scared to be alone.?,"ссорюсь со своим парнем, но боюсь оставаться одна.?"
how can i convince my mom?,как я могу убедить свою маму?
Forever21 pants fitting?,Брюки Forever21 подходят по размеру?
Taylor Lautner Vs. Ryan Reynolds?,Тейлор Лотнер Против. Райан Рейнольдс?
My husband and i had unsafe sex  a night  prior to my period. i got my period the next day. is it still safe.?,У нас с мужем был небезопасный секс за ночь до моих месячных. на следующий день у меня начались месячные. это все еще безопасно.?
What's the cheapest and best radio scanner on the market?,Какой самый дешевый и лучший радиосканер на рынке?
What happens when someone takes too much Fiber in their body?,"Что происходит, когда кто-то потребляет слишком много клетчатки в своем организме?"
The pic messages I sent from my cell will not download. Is it a settings problem?,"Текстовые сообщения, которые я отправил со своего мобильного, загружаться не будут. Это проблема с настройками?"
was malcolm x considered at a civil rights leader? why?,рассматривался ли Малкольм Икс в качестве лидера движения за гражданские права? почему?
This guy just asked me out but he just broke up with my best friend:S?,"Этот парень только что пригласил меня на свидание, но он только что расстался с моей лучшей подругой: С?"
Why K2O2 is possible and KO is not in terms of atomic structure? (10 points)?,"Почему K2O2 возможен, а KO - нет с точки зрения атомной структуры? (10 баллов)?"
How Do I Get In Better Shape ?,Как Мне привести Себя В Лучшую Форму?
"I'm actually still pregnant, but I want a big family is it easy to get pregnant right away again?","На самом деле я все еще беременна, но я хочу большую семью легко ли снова сразу забеременеть?"
"We are married, in love, but living separately?","Мы женаты, влюблены, но живем отдельно?"
Epic start to the New Year Help!?,Эпическое начало Нового года Помогите!?
For anyone who can backflip?,"Для всех, кто умеет делать сальто назад?"
Nora Katherine or Reagan Leah?,Нора Кэтрин или Рейган Ли?
Wrestling Section poll: Which hand do you wipe your ass with?,Опрос секции борьбы: Какой рукой ты вытираешь свою задницу?
Can someone help me with how long will it'll take to get to mars?,"Кто-нибудь может мне помочь с тем, сколько времени потребуется, чтобы добраться до Марса?"
Why Are So Many New Yorkers Flocking to Evangelical Christian Preacher Tim Keller?,Почему так много жителей Нью-Йорка стекаются к проповеднику евангельских христиан Тиму Келлеру?
How much air pressure is required for my run-flat tires. I have a 2007 Lexus SC-430?,Какое давление воздуха требуется для моих спущенных шин. У меня есть Lexus SC-430 2007 года выпуска?
Is it true that younger men very seldomly take older women seriously?,"Правда ли, что молодые мужчины очень редко воспринимают пожилых женщин всерьез?"
what would be a bad reason for revolution?,что было бы плохой причиной для революции?
what american vice president has to do with or is somehow associated with the word nabob?,какое отношение американский вице-президент имеет к слову набоб или как-то ассоциируется с ним?
any one on xbox live a girl?,есть ли у кого-нибудь на xbox live девушка?
Do you know any guys that have no problem getting girlfriends ?,"Ты знаешь каких-нибудь парней, у которых нет проблем с тем, чтобы завести подружек?"
If you have eye contact for more than 2 seconds with a girl does that mean she likes you?,"Если вы смотрите девушке в глаза более 2 секунд, означает ли это, что вы ей нравитесь?"
"Is ""a recipe for disaster"" a metaphor?","Является ли ""рецепт катастрофы"" метафорой?"
Extreme Fear Of Choking?,Сильный Страх Задохнуться?
"What do some of the christians on here think about the movie ""Legion""?","Что некоторые из присутствующих здесь христиан думают о фильме ""Легион""?"
I was watching Road Fools on  Fuel Tv and I want to know the  name of this song....?,"Я смотрел Road Fools по Fuel Tv, и я хочу знать название этой песни....?"
I Need Some Good Books For A Teen Girl?,Мне Нужно Несколько Хороших Книг Для Девочки-Подростка?
Can I run an ICS on my computer  and a wireless router at the same  time?,Могу ли я запустить ICS на своем компьютере и беспроводном маршрутизаторе одновременно?
What is the pH of a .05 Molar HCl solution?,"Каков рН 0,05 молярного раствора HCl?"
How to get bigger breasts ?,Как увеличить грудь?
Experience with working in a hostel in UK?? preferably London.. (+live in)?,Опыт работы в хостеле в Великобритании?? предпочтительно Лондон.. (+живете в)?
How can I gain more weight during my pregnancy?,Как я могу набрать больше веса во время беременности?
how many ways can you make the number ten?? e.g 1 add 9 =10 ect?,"сколькими способами вы можете составить число десять?? например, 1 прибавить 9 = 10 и т.д.?"
call of duty modern warfare 2 (xbox 360)?,call of duty modern warfare 2 (xbox 360)?
Does he really want to be just friends?,Действительно ли он хочет быть просто друзьями?
Are small gray snakes dangerous?,Опасны ли маленькие серые змеи?
How do insulators discharge?,Как разряжаются изоляторы?
UCLA or Berkeley? idk which is better?,"Калифорнийский университет в Лос-Анджелесе или Беркли? idk, который лучше?"
Anyone else excited about CM Punk vs. Rey Mysterio?,Кто-нибудь еще в восторге от CM Punk vs. Рей Мистерио?
How come stupid crap makes me wet these days?,"Как так получилось, что от глупого дерьма я становлюсь мокрой в эти дни?"
is there a posibility that snow will fall on april in pittsburgh?,"есть ли вероятность, что в апреле в Питтсбурге выпадет снег?"
Do you know the way to sesame street?,Ты знаешь дорогу на улицу Сезам?
"What are the rules for playing on ""your"" National Team?","Каковы правила игры в ""вашей"" национальной команде?"
what is a troll on yahoo answrs?,что такое тролль на yahoo answers?
iPod Touch or Sony Walkman? Is the iPod Touch really that amazing?,iPod Touch или Sony Walkman? Действительно ли iPod Touch настолько удивителен?
HHH Doesnt Remember.?,ХХХХ Не помнит.?
How can you tell if your dog has arthritis?,"Как вы можете определить, есть ли у вашей собаки артрит?"
"What does ""she's a corpse"" mean?","Что значит ""она труп""?"
Under which conditions would asexual plants have the greatest advantage over sexual plants?,При каких условиях бесполые растения имели бы наибольшее преимущество перед половыми растениями?
Media Go Movie Rental question?,Вопрос о прокате фильма Media Go?
iM Confuse to Wether iM bi Or Gay.?,"Я путаю, би я или Гей.?"
ladies why do you hide your feelings for guys?!*****************?,"дамы, почему вы скрываете свои чувства к парням?!*****************?"
simplify this: 15^24 x 15^-12 x 15^6?,упростим это: 15 ^ 24 x 15^-12 x 15^ 6?
migrate database to another computer?,перенести базу данных на другой компьютер?
what should i do.. he cheated on me forever ago..?,что мне делать.. он изменил мне целую вечность назад..?
Did Shakespeare usually make his menacing characters redheaded?,Обычно ли Шекспир делал своих грозных персонажей рыжеволосыми?
where can i find a zebra tie?,"где я могу найти галстук в стиле ""зебра""?"
I have been dating this girl for about 5 weeks now.?,Я встречаюсь с этой девушкой уже около 5 недель.?
What is my -350 Eyeglass Prescription translate into a contact prescription?,Как переводится мой рецепт на очки стоимостью 350 долларов в рецепт на контактные линзы?
I got something to ask about the achievements on my XBOX 360?,Я хочу кое-что спросить о достижениях на моем XBOX 360?
"Religiously speaking, should America keep strictly defining accepted gender roles?","С религиозной точки зрения, должна ли Америка продолжать строго определять принятые гендерные роли?"
what age should you recommend to wear foundation at?,в каком возрасте вы рекомендуете наносить тональный крем?
Nobody seems to care about my birthday :'|?,"Кажется, никого не волнует мой день рождения :'|?"
"what do people mean when they say they have ""islands"" in their houses?","что люди имеют в виду, когда говорят, что у них в домах есть ""острова""?"
The quasars with the largest presently known redshifts are close to?,Квазары с наибольшими известными в настоящее время красными смещениями близки к?
how can i increase/improve my reflexes?,как я могу увеличить / улучшить свои рефлексы?
Are there any cases of euthanasia in NZ?,Есть ли какие-либо случаи эвтаназии в Новой Зеландии?
I am confused about my bridal make up - ambika pillai or lakme ?? or anyone else..?? plz advice..?,Я в замешательстве по поводу моего свадебного макияжа - амбика пиллаи или лакме?? или кто-нибудь еще..?? совет плз..?
summer ONLINE jobs for teens?,летние ОНЛАЙН-вакансии для подростков?
do woman like anal sex?,нравится ли женщине анальный секс?
Why is that that Black people don't smile when they get their picture taken.?,"Почему чернокожие люди не улыбаются, когда их фотографируют??"
filipino candy? not sure what its called?,"филиппинские конфеты? не уверен, как это называется?"
help me determine what type of reaction this is (chemisty)?,"помогите мне определить, что это за реакция (химическая)?"
are these signs my best guy friend likes me?,"это признаки того, что я нравлюсь моему лучшему другу-парню?"
Would It Be Bad To Drink Energy Coffee Drinks&&Monsters With Mood Stabilizer Medication?,"Было бы Плохо Пить Энергетические Кофейные напитки и & Amp; Монстры С лекарствами, стабилизирующими настроение?"
What is normal body temp.? Is 99.2 F a fever?,"Какова нормальная температура тела? 99,2 градуса по Фаренгейту - это лихорадка?"
"Do I have to keep employee if he gives notice, California?","Должен ли я оставить сотрудника, если он подаст уведомление, Калифорния?"
"Two backstabbing ""best"" friends....I need advice?","Два вероломных ""лучших"" друга....Мне нужен совет?"
A square with a side of 10 is increased to a side of 12. By how much is the diagonal increased?,Квадрат со стороной 10 увеличивается до стороны 12. На сколько увеличивается диагональ?
Starhub d-link router dcm-604?,Маршрутизатор Starhub d-link dcm-604?
how do you put a movie that is an avi file in sony vegas 9?,как поместить фильм в формате avi в sony vegas 9?
Acid and bases clarification..?,Осветление кислот и щелочей..?
What speed of reflexes in milliseconds would be superhuman?,Какая скорость рефлексов в миллисекундах была бы сверхчеловеческой?
can psychics see there future to?,могут ли экстрасенсы видеть там будущее?
Presidential library?,Президентская библиотека?
Guys - When will this guy call me?,"Ребята, когда этот парень мне позвонит?"
I had a bee/yellow jacket nest in my grill.?,У меня в гриле было пчелиное гнездо в желтой куртке.?
What do I need to do to be able to call people internationally from other countries to the U.S.?,"Что мне нужно сделать, чтобы иметь возможность звонить людям по всему миру из других стран в США?"
Age of compulsory education in the USA?,Возраст обязательного образования в США?
Whats the square root of 56?,Каков квадратный корень из 56?
BB - Dave discussing Josie's weight?,Би-би-си - Дейв обсуждает вес Джози?
Which side to wear my evil eye bracelet on?,С какой стороны носить мой браслет от сглаза?
what's the absolute best thing you've ever eaten at a 1st class restaurant?,что самое вкусное вы когда-либо ели в ресторане первого класса?
How many dirigibles are in the world?,Сколько дирижаблей в мире?
R&S: What's your IQ and are you an Atheist or do you believe in God?,R&S: Каков ваш IQ и являетесь ли вы атеистом или верите в Бога?
Can someone translate this English sentence to Russian cyrillic? please :)?,Кто-нибудь может перевести это английское предложение на русскую кириллицу? пожалуйста :)?
Are Arizona tea cans refundable?,Подлежат ли возврату банки аризонского чая?
Accounting is no fun :(?,Бухгалтерия - это неинтересно :(?
what is a good software for helping with college essay writing?,какое хорошее программное обеспечение поможет в написании эссе для колледжа?
What is the blood pressure of an average 17 year old girl?,Какое кровяное давление у среднестатистической 17-летней девушки?
Please help me with this weird Dream?,"Пожалуйста, помоги мне с этим странным сном?"
rat terrier good with other dogs?,крысиный терьер хорошо ладит с другими собаками?
Is this laptop a good buy?,Является ли этот ноутбук хорошей покупкой?
"How much time does it take for $50 to go from a Bank Account, transferred to a Paypal?",Сколько времени требуется для перевода 50 долларов с банковского счета на Paypal?
can long alcohol and meth abuse make your immune system wbc weak after you have stopped using?,"может ли длительное злоупотребление алкоголем и метамфетамином ослабить вашу иммунную систему после того, как вы прекратили употреблять?"
Cheap laptop that will play WoW?,"Дешевый ноутбук, который будет играть в WoW?"
10pts-GIRLS-WOMEN---your advice on HOT BAD BOYS....?,10 очков-ДЕВОЧКИ-ЖЕНЩИНЫ---ваш совет по поводу ГОРЯЧИХ ПЛОХИХ ПАРНЕЙ....?
Claremont Hotel in Blackpool?,"Отель ""Клермонт"" в Блэкпуле?"
deflon 500 in DVT treatment?,дефлон 500 в лечении ТГВ?
I'm not receiving emails?,Я не получаю электронные письма?
what does men perfume smell like? Help please?,"как пахнут мужские духи? Помогите, пожалуйста?"
Does a contested temporary guardian have the right to sell the elderly persons property?,Имеет ли оспариваемый временный опекун право продавать имущество пожилых людей?
"Titanic Story, Would he be my second great grandpa?","История Титаника, был бы он моим вторым прадедушкой?"
"New Sanyo camcorder, the lcd image shakes a bit - and the recorded result is the same..?","Новая видеокамера Sanyo, изображение на ЖК-дисплее немного дрожит - и записанный результат тот же ..?"
Do you like chocolate?,Вы любите шоколад?
Why Am I Seeing Shadow People?,Почему я вижу Людей-теней?
Is being able to stick your tongue behind your tonsils rare or can a lot of people do it?,Редка ли возможность засунуть язык за миндалины или это под силу многим людям?
how do i get rid of a cold sore on the side of my mouth?,как мне избавиться от герпеса в уголке рта?
How to lose that last 5kg (10 pounds)?,Как сбросить эти последние 5 кг (10 фунтов)?
Should I take her back as a friend?,Должен ли я принять ее обратно как друга?
Hey do you like smoking weed?,"Эй, тебе нравится курить травку?"
How much is microsoft worth ?,Сколько стоит microsoft?
Why does my dog pee on his bed!??!?HELP!!?,Почему моя собака писает на свою кровать!??!?ПОМОГИТЕ!!?
Not sure what this question is refering to. Please Help.?,"Не уверен, к чему относится этот вопрос. Пожалуйста, помогите.?"
whats wrong with my laptop?,что не так с моим ноутбуком?
Pokemon Gold Help ........................................?,Золотая помощь покемонов ........................................?
Which name combination do you prefer?,Какое сочетание имен вы предпочитаете?
Ideas about the internet?,Идеи об Интернете?
What'd you think of this crossover where Derrick Rose broke Tyreke Evans ankles last Saturday Night?,"Что вы думаете об этом кроссовере, где Деррик Роуз сломал лодыжки Тайрику Эвансу в прошлую субботу вечером?"
"Pick a middle name- Alexis, Brooklyn, or Marie?","Выбери второе имя - Алексис, Бруклин или Мари?"
where is a good place to order pointe shoes?,где лучше всего заказать пуанты?
im pregnant but i dont have my appt to the ob til the 14th but i have abdomin and lower back pain?,"я беременна, но у меня нет аппт к акушеру до 14-го числа, но у меня боли в животе и пояснице?"
Algebra II questions?,Вопросы по алгебре II?
he does all this but doesnt want a relationship?,"он делает все это, но не хочет отношений?"
I Need A NIckname for him. help me out?,Мне нужно придумать для него прозвище. поможешь мне выбраться?
error message pops up won't go away?,всплывающее сообщение об ошибке не исчезнет?
Was stephen austin actually IN the texas revolution?,Действительно ли Стивен Остин участвовал В техасской революции?
My dad accidentally hurt a bird and so?,Мой папа случайно ранил птицу и что с того?
Good site for teaching acoustic guitar?,Хороший сайт для обучения игре на акустической гитаре?
"Really quick question, easy answers...?","Действительно быстрый вопрос, простые ответы...?"
phenomenon in which products of a hybrid cross are hardier than either of the species that produced them?,"явление, при котором продукты гибридного скрещивания более выносливы, чем любой из видов, которые их произвели?"
If I want to get a job in the FBI or CIA when I am older what should I get into the ARMY?,"Если я захочу устроиться на работу в ФБР или ЦРУ, когда стану старше, что мне следует взять в АРМИЮ?"
A package is dropped from a passing plane(moving in the horizantal direction) and produces a projectile motion?,Пакет сбрасывается с пролетающей плоскости (движущейся в горизонтальном направлении) и создает движение снаряда?
"How can you tell if ""Notch"" has joined your server on Minecraft?","Как вы можете определить, присоединился ли ""Notch"" к вашему серверу в Minecraft?"
