en,ru
what is your favourite building?,какое ваше любимое здание?
how hard is it to become pregnet after your tubes are untied?,"насколько трудно забеременеть после того, как ваши трубы развязаны?"
Help plzz?!?,"Помогите, пожалуйста?!?"
Are these shoes ok for a guy to wear?,Подходит ли эта обувь парню для ношения?
does anyone know of any face and hair masks recipies that you can make at home?,"кто-нибудь знает какие-нибудь рецепты масок для лица и волос, которые вы можете приготовить дома?"
Is 70000 miles alot for a 52 reg clio?,70000 миль - это много для 52-дюймового clio?
does anybody like any 80's music if so why??,"нравится ли кому-нибудь музыка 80-х, если да, то почему??"
Where can I rent a carpet shampoo machine?,Где я могу взять напрокат машину для мытья ковров?
Looking for opinions on a fight?,Ищете мнения о драке?
is there really some one there for me?,действительно ли там кто-то есть для меня?
"Has anyone heard that Whoopi Goldberg defended Michael Vick on ""The View"" today?","Кто-нибудь слышал, что Вупи Голдберг сегодня защищала Майкла Вика в ""The View""?"
Which sleeper truck would be best to use in the city as well as short haul?,"Какой спальный грузовик лучше всего использовать как в городе, так и на коротких маршрутах?"
If a zookeeper gives a monkey a lighter......?,Если смотритель зоопарка даст обезьяне зажигалку......?
is it possible for a man to be afraid to struggle and risk even they love sone one?,"возможно ли, чтобы мужчина боялся бороться и рисковать, даже если он любит единственного?"
Why does my gut tell me he likes me when he's not even acting like it?,"Почему мое чутье подсказывает мне, что я ему нравлюсь, когда он даже не ведет себя подобным образом?"
Brand new SADDLE! HELP HELP HELP!?,"Совершенно новое СЕДЛО! ПОМОГИТЕ, ПОМОГИТЕ, ПОМОГИТЕ!?"
48 hour hollywood miracle diet?,48-часовая голливудская чудо-диета?
My malshih is acting like he is gagging his nose was warmdry now normal could he have ate somethings caught,"Мой малыш ведет себя так, как будто его тошнит, его нос был теплым, а теперь нормальным, мог ли он съесть что-нибудь пойманное"
anyone? a little help with physics?,кто-нибудь? немного помочь с физикой?
What to do when you know someone is lying?,"Что делать, когда вы знаете, что кто-то лжет?"
How do i activate my GPRS if i'm using a Touch Mobile Simcard?,"Как мне активировать свой GPRS, если я использую sim-карту Touch Mobile?"
‰Ыў‰Ыў‰Є»‰Є»  Can you will in the blanks with LYRICS  from BEATLES tunes to create amusing sentences?,"‰Ыў‰Ыў‰Є""‰Є"" Можете ли вы заполнить пробелы текстами песен BEATLES, чтобы создать забавные предложения?"
Foreign plurals that creep into the English language.  Anybody else think they're kind of fun to use?  Can you,"Иностранные множественного числа, которые проникают в английский язык.  Кто-нибудь еще считает, что ими довольно забавно пользоваться?  Ты можешь"
Do we need another McCarthy Era to rid Congress of all the Socialists posing as Democrats?,"Нужна ли нам еще одна эпоха Маккартизма, чтобы избавить Конгресс от всех социалистов, выдающих себя за демократов?"
What can I do to make myself want breakfast in the morning?,"Что я могу сделать, чтобы заставить себя хотеть завтракать по утрам?"
confuzed.....?,сбит с толку.....?
Aviation careers thats suitable for me?,"Авиационная карьера, которая мне подходит?"
Help calculating molarity?,Помогите рассчитать молярность?
has a book ever effected your life or maybe even changed you ?,"повлияла ли когда-нибудь книга на вашу жизнь или, может быть, даже изменила вас?"
If 5 cards are dealt from an ordinary deck find the odds that 4 kings are in the hand?,"Если раздается 5 карт из обычной колоды, найдите вероятность того, что в раздаче окажется 4 короля?"
Do you believe in the rainbow bridge?,Вы верите в радужный мост?
boy problem?,проблема с мальчиком?
what is gastroenterology?,что такое гастроэнтерология?
Which Guitar Tab Sites are Legal?,Какие сайты с вкладками Guitar являются легальными?
When eating every 2 1/2 hours how many ounces of food should you dish out?,"При приеме пищи каждые 2 1/2 часа, сколько унций пищи вы должны выкладывать на тарелку?"
i saw something on a tv show would this be considered blasphemy of any sort?,"я видел кое-что в телешоу, будет ли это считаться каким-либо богохульством?"
How long will it take salt to kill grassplants and small trees?,"Сколько времени потребуется соли, чтобы уничтожить травянистые растения и небольшие деревья?"
How to claim benefitios of UK govement no work?,"Как претендовать на льготы правительства Великобритании ""Нет работы""?"
will the files be deleted now?,будут ли файлы удалены сейчас?
Do you find people of your own race more or less attractive than people from another?,"Находите ли вы людей вашей собственной расы более или менее привлекательными, чем люди другой расы?"
i'm about to start making a scrapbook but i don't know what to make the book from (see details)?,"я собираюсь начать делать альбом для вырезок, но я не знаю, из чего сделать книгу (см. подробности)?"
did they ever find madeliene mcann?,нашли ли они когда-нибудь Маделин Макэнн?
quote from the virginia company of london?,цитата из лондонской вирджинской компании?
Is Alex Zane really that much of a c#nt?,Действительно ли Алекс Зейн настолько разбирается в c#nt?
James Khan on Dragons Den-looks like Charles Frier from Howards Way?,"Джеймс Хан в ""Логове драконов"" - похож на Чарльза Фрира из ""Пути Говардса""?"
Has anybody had or heard of a cure for Trichotillomania?,Кто-нибудь пробовал или слышал о лекарстве от трихотилломании?
I want to know sharon salazar 27 FEMALE yahoo email ID?,"Я хочу знать Шарон Салазар, 27 ЛЕТ, ЖЕНСКИЙ идентификатор электронной почты yahoo?"
Should I buy games from my friend?,Должен ли я покупать игры у своего друга?
Does he like Me?,Нравлюсь ли я ему?
How to go Thippasandara from Bangalore Railway station?,Как добраться до Типпасандары с железнодорожного вокзала Бангалора?
Why do kids in the UK always dress up as monsters for Halloween?,Почему дети в Великобритании всегда наряжаются монстрами на Хэллоуин?
i have a AKAI television if i buy a AKAI remote will it work?,"у меня есть телевизор AKAI, если я куплю пульт AKAI, будет ли он работать?"
is the name aurangabad is best or it should b rename as sambajinagar?,является ли название аурангабад лучшим или его следует переименовать в самбаджинагар?
hey everyone?,всем привет?
ALL the songs on my itunes dissappeared!?,ВСЕ песни в моем itunes исчезли!?
"The scientist who utilized pea plants to conclude that ""factors"" determine inheritance was?","Ученый, который использовал растения гороха для вывода о том, что ""факторы"" определяют наследование, был?"
Should a married person to stay in touch with ex-spouses and ex-lovers when they shared no children?,"Должен ли женатый человек поддерживать связь с бывшими супругами и бывшими любовницами, когда у них нет общих детей?"
new boyfriend?,новый парень?
Any suggestions for dealing with guilt?,Есть какие-нибудь предложения по борьбе с чувством вины?
"Have Christian ""Scientists"" changed their minds in the face of this kind of loss?","Изменили ли христианские ""ученые"" свое мнение перед лицом такого рода потерь?"
Considering America was at its greatest while Clinton was president why wouldn't we want Hillary?,"Учитывая, что Америка была на пике своего расцвета, когда Клинтон была президентом, почему бы нам не хотеть Хиллари?"
Where can I find three public OUIs held by Cisco?,"Где я могу найти три общедоступных интерфейса, принадлежащих Cisco?"
how do i do back handspring?,как мне сделать обратную ручную пружину?
What is the best pillow to buy to prevent waking up with neck aches?,"Какую подушку лучше всего купить, чтобы не просыпаться с болями в шее?"
If you could talk to one person again in your life living or deceased who would that person be?,"Если бы вы могли снова поговорить с одним человеком в своей жизни, живым или умершим, кто бы это был?"
Need help in getting the right jersey size!?,Нужна помощь в выборе правильного размера трикотажа!?
what happened with her?,что с ней случилось?
How do I turn off group policy so that I can enable Windows Firewall?,"Как мне отключить групповую политику, чтобы я мог включить брандмауэр Windows?"
Can i restore my dell lptops hardrive?,Могу ли я восстановить свой жесткий диск dell lptops?
Where can I find Marciano by Guess outlets (other than Cali)? Any in NY Mississippi Alabama Florida? TY!?,"Где я могу найти торговые точки Marciano by Guess (кроме Cali)? Есть кто-нибудь в Нью-Йорке, Миссисипи, Алабаме, Флориде? ТАЙ!?"
Info about The Misfits?,Информация о неудачниках?
science and religion are the same. any reasons for that?,наука и религия - это одно и то же. какие-нибудь причины для этого?
How do I enlarge thumnails without distortion?,Как увеличить ногти на больших пальцах без искажений?
I can't believe I am asking this but........do you all remember the name of this song?,"Я не могу поверить, что спрашиваю об этом but........do вы все помните название этой песни?"
anybody hear of this company??,кто-нибудь слышал об этой компании??
BIG SOUL=SUN?EARTH WOMB contain a SON of SUN?the MUSLIMS had WORSHIPS d SQUARE ROOT KAABA.Any OPINION pls?,"БОЛЬШАЯ ДУША = СОЛНЦЕ? ЗЕМНОЕ ЧРЕВО содержит СЫНА СОЛНЦА? МУСУЛЬМАНЕ ПОКЛОНЯЛИСЬ КААБЕ с КВАДРАТНЫМ КОРНЕМ.Есть какое-нибудь МНЕНИЕ, пожалуйста?"
Do's and Dont's of working retail?,Что делать и чего не делать в розничной торговле?
Whos sound like who?,Кто на кого похож?
Does this mean it's just about over?,"Значит ли это, что все вот-вот закончится?"
what are some sites like image chef?,"каковы некоторые сайты, подобные image chef?"
how does getting your toungue pierced hurt? what are the risks?,как больно прокалывать палец? каковы риски?
picture studio question?,вопрос из фотостудии?
When the government runs a budget deficit all the following happen EXCEPT:?,"Когда правительство сталкивается с дефицитом бюджета, происходит все следующее, за исключением:?"
Physics HELP?,Физика ПОМОЖЕТ?
help please relationship issues?,"помогите, пожалуйста, с проблемами взаимоотношений?"
What's a good christmas gift for someone who is already getting an iphone for a present?,"Какой хороший рождественский подарок для того, кто уже получает iphone в подарок?"
Stopping a BYB in my town?,Останавливать BYB в моем городе?
Is this right?  I need to convert 112.2kPa to atm.  I got .0011073.  Is this the right answer? Thanks.?,"Правильно ли это?  Мне нужно преобразовать 112,2 кПа в атм.  У меня есть .0011073.  Правильный ли это ответ? Спасибо.?"
My wiimotes won't register in Guitar Hero 3?,Мои wiimotes не будут регистрироваться в Guitar Hero 3?
What do I need to take into consideration before installing firewire?,Что мне нужно принять во внимание перед установкой firewire?
a 3db loss is equivalento to what of total signal?,потеря в 3 дБ эквивалентна какой части общего сигнала?
hot girls or not?  TEENS/ADOLESCENTS GUYS ONLY !!?,горячие девушки или нет?  ПОДРОСТКИ/ТИНЕЙДЖЕРЫ ТОЛЬКО ДЛЯ ПАРНЕЙ !!?
How much does it cost to knock down a load bearing wall and install a RSJ?,Сколько стоит снести несущую стену и установить RSJ?
Do girls *really* like being called these things:?,"Действительно ли девушкам * нравится, когда их так называют:?"
GIRLS what to u really like in a guy?,"ДЕВУШКИ, что вам действительно нравится в парне?"
Webkinz doesn't recognize my daughter on log-in!?,Webkinz не узнает мою дочь при входе в систему!?
Chronicles of Narnia movies?,"Фильмы ""Хроники Нарнии""?"
TRUE CRIME nEW YORK CITY GAME?,НАСТОЯЩАЯ КРИМИНАЛЬНАЯ ИГРА В Нью-ЙОРКЕ?
Wedding videographers question?,Вопрос свадебных видеографов?
why SK should not be abolished!!!???,почему СК не следует упразднять!!!???
"If someone age ""8"" has a rating of 1800 are they(if answer is yes or no please give reason why) a genius?","Если у кого-то в возрасте ""8"" рейтинг 1800, является ли он (если ответ ""да"" или ""нет"", пожалуйста, укажите причину) гением?"
butterfingers or hersheys?,баттерфингеры или Херши?
who is like me??????,кто похож на меня??????
Is this just braxton hicks? I'm 32 weeks pregnant?,Это просто Брэкстон Хикс? Я на 32 неделе беременности?
I am not being able to remove Printmaster(this is an old one I put on)off of control panel.?,"Я не могу удалить Printmaster (это старый, который я включил) с панели управления.?"
Is this too much to get a friend for christmas?,"Не слишком ли это много, чтобы подарить другу на Рождество?"
Wat do ya do witj ur points?,Что ты делаешь с твоими очками?
my friend texts me thru aim and it wasts my money and he does it on purpose how do i stop it?,"мой друг пишет мне через aim, и это тратит мои деньги впустую, и он делает это нарочно, как мне это остановить?"
which is more expensive. Hollister Banana Republic Guess etc?,что обходится дороже. Догадка о Банановой республике Холлистера и т.д.?
Changing the rear struts on my 1992 Chevy Lumina?,Меняете задние стойки на моем Chevy Lumina 1992 года выпуска?
does the xbox 360 play bleuray disc?,воспроизводит ли xbox 360 диск bleuray?
What should i do?,Что я должен делать?
how much??,сколько??
How many hours at day do i have to workout? to get a six pack?,Сколько часов в день я должен тренироваться? чтобы купить упаковку из шести штук?
The fallout of a critical partner's actions?,Последствия действий критически настроенного партнера?
iTunes to iPod?,iTunes на iPod?
where the maximum bangladeshi population located in london?,где в Лондоне проживает максимальное количество бангладешцев?
Hello Friends Anybody can help me to get good stock in Indian Stock market for investing.?,"Здравствуйте, друзья, кто-нибудь может помочь мне приобрести хорошие акции на индийском фондовом рынке для инвестирования.?"
can someone pleace tell me how to create a website?????,"может кто-нибудь, пожалуйста, рассказать мне, как создать веб-сайт?????"
is there any fertility drug i can buy over the counter?,"есть ли какое-нибудь лекарство от бесплодия, которое я могу купить без рецепта?"
hours long?,долгие часы?
Best site for Vegetarian & Vegan Food Pyramid?,Лучший сайт для вегетарианской пищевой пирамиды?
Who's avatar really looks like them???,Чей аватар действительно похож на них???
"After taking pictures on my cybershot camera I now have a ""reinsert memory stick"" error. What do I do? help!","После съемки на мою камеру cybershot теперь у меня появляется ошибка ""повторно вставить карту памяти"". Что мне делать? помогите!"
"song lyrics ""i breathe the moon and eat the sun"" whos it by?","текст песни ""я дышу луной и ем солнце"" от кого это?"
am i very hermit-like or am i too picky??,я очень похож на отшельника или я слишком разборчив??
Yucky colorless wet...see details?,Отвратительная бесцветная влага...увидеть подробности?
DO l NEED A GIRLFRIEND?,НУЖНА ЛИ МНЕ ДЕВУШКА?
"What does ""Capias Issued"" mean?","Что означает ""Выданные подписи""?"
how to create a web page & upload photos & videos?,как создать веб-страницу и загружать фотографии и видео?
FACEBOOK  how do i block someone in NO network that i have contacted through a msg?,"FACEBOOK как мне заблокировать кого-либо из сети, с кем я связался через сообщение электронной почты?"
guys who are red heads do you like dark haired women?,"парни, которые рыжеволосые, вам нравятся темноволосые женщины?"
Heart Brokenor am I?,"Сердце разбито, или это я?"
Is love stong enough for this??????,Достаточно ли сильна любовь для этого??????
No longer a human being?,Больше не человек?
Is there anything random/funny you can say in German?,"Есть ли что-нибудь случайное / смешное, что вы можете сказать по-немецки?"
meet the spartans?,встретиться со спартанцами?
With TO crying his eyes out do you think he could give Hillary Clinton a run for her money.?,"С выплаканными глазами, как вы думаете, он мог бы дать Хиллари Клинтон шанс побороться за ее деньги.?"
how do i find the colts contct for a player in NFL need payton manning? contact number/coach?,как мне найти контракт с colts для игрока в NFL need Пэйтон Мэннинг? контактный номер/тренер?
Darkening of Areolas?,Потемнение ареол?
Y iz there a need for a dress code? not a uniform just lyk no spagetti straps and stuff. backup proof 2 pleez?,"Есть ли необходимость в дресс-коде? не униформа, просто лайк, никаких лямок от спагетти и прочего. резервное доказательство 2, пожалуйста?"
Who watches THE BAD GIRLS CLUB?!?,"Кто смотрит ""КЛУБ ПЛОХИХ ДЕВОЧЕК""?!?"
Hair roots explain?,Корни волос объясняют?
Wii USB Keyboard (has anyone in Australia been successful in using one)?,Клавиатура Wii USB (кто-нибудь в Австралии успешно пользовался ею)?
"How to access a Web page posted on Apache Web Server installed as ""Localhost"" on another machine ?","Как получить доступ к веб-странице, размещенной на веб-сервере Apache, установленном как ""Localhost"" на другой машине?"
Is there anywhere I can play Nientendo games online (Zelda-Link to the past)?,"Есть ли где-нибудь, где я могу поиграть в игры Nientendo онлайн (Zelda-Ссылка на прошлое)?"
Define neo-beralism GDP GNP and TNC?,Дайте определение неонацизму ВВП ВНП и ТНК?
Do u guys like this song and what is the most romantic song to decribe a boy?,"Нравится ли вам, ребята, эта песня и какая самая романтичная песня для описания парня?"
where can i get a purity ring?,где я могу получить кольцо чистоты?
Nature of the roots question?,Природа вопроса о корнях?
If my hubby is up to date on IRS payments will they take both state and federal returns?,"Если мой муженек в курсе платежей Налогового управления, будут ли они принимать декларации как штата, так и федерального уровня?"
xbox 360...?,xbox 360...?
"strange ""Dream""? what do i do?","странный ""сон""? что мне делать?"
Do I have any chance in Berkeley or UCLA with two Ds on my senior first semester?,Есть ли у меня какие-нибудь шансы в Беркли или Калифорнийском университете в Лос-Анджелесе с двумя дипломами бакалавра в моем выпускном первом семестре?
ipod touch internet?,ipod touch подключается к Интернету?
Do u reckon Ana Ivanovic looks pretty without makeup?,"Как вы считаете, Ана Иванович красиво выглядит без макияжа?"
How do I turn java scipt on?,Как мне включить java scipt?
Is it possible to charge a cellphone using electrolytes? Does anyone know a method of how to do so?,"Можно ли зарядить мобильный телефон с помощью электролитов? Кто-нибудь знает способ, как это сделать?"
