en,ru
Difference between a terrorist attack and military attack?,Разница между террористической атакой и военным нападением?
do any of u guys know what ROUXS stands for?,"кто-нибудь из вас, ребята, знает, что означает ROUXS?"
Some good hair styles?,Какие-нибудь хорошие прически?
what is the lyrics to the Queensland state of origin team song?,каков текст песни команды штата Квинсленд о происхождении?
what is the ingredient(s) in deodorant that causes cancer?,какой ингредиент (ы) в дезодоранте вызывает рак?
What's up with Adam at the end of Y & R today?,Что случилось с Адамом в конце Y & R сегодня?
world of warcraft all i HAVE to know?,"world of warcraft - все, что мне нужно знать?"
How to get rid of stretch marks?,Как избавиться от растяжек?
Is the South Pole ever cold in October?,Бывает ли на Южном полюсе когда-нибудь холодно в октябре?
How much weight do you think I can lose?,"Как ты думаешь, сколько веса я могу сбросить?"
I deleted my account but i try and sign up for that name.. it says it in use?,"Я удалил свою учетную запись, но я пытаюсь зарегистрироваться под этим именем .. там написано, что оно используется?"
How could a high school student test different types of chocolate to see which is healthier?,"Как мог бы старшеклассник протестировать разные виды шоколада, чтобы определить, какой из них полезнее?"
Is he ignoring me or what!!?!?,Он игнорирует меня или что!!?!?
Mixed Breed Life Span?,Продолжительность жизни смешанной породы?
"Where can I watch this certain episode from ""Reba""?","Где я могу посмотреть этот конкретный эпизод из ""Реба""?"
For those of you that have the Nintendo DSi how is the internet on it?,"Для тех из вас, у кого есть Nintendo DSi, как на нем работает Интернет?"
More Marine deaths in Afghanistan so according to Dems that makes Obama a murderer correct?,"Больше смертей морских пехотинцев в Афганистане, так что, по мнению демократов, это делает Обаму убийцей, верно?"
I'm white my boyfriend's black my dad won't accept it. What can I do?,"Я белая, мой парень черный, мой отец этого не примет. Что я могу сделать?"
How many ribs does a human have?,Сколько ребер у человека?
define microsoft word?,определите microsoft word?
How much are dog vaccinations usually?,Сколько обычно стоит вакцинация собак?
How to do this question on Binomial Theorem?,Как ответить на этот вопрос по биномиальной теореме?
Which is the most biased cable news station available to the public?,"Какая кабельная новостная станция является наиболее предвзятой, доступной широкой публике?"
dell or hp? laptop or netbook for a student? sims? HELP!?,dell или hp? ноутбук или нетбук для студента? симы? ПОМОГИТЕ!?
To call or not to call half brother?,Звонить или не звонить сводному брату?
Should I buy these boots?,Должен ли я купить эти ботинки?
How do I tell when boyfriend/husband no longer has HPV?,"Как мне определить, что у парня / мужа больше нет ВПЧ?"
"How can i maintain my ""mixed"" hair?","Как я могу поддерживать свои ""смешанные"" волосы?"
Why is being drunk a sin?,Почему быть пьяным - это грех?
I need help. How can I factor the following:?,Мне нужна помощь. Как я могу учесть следующее:?
Summer hair styles :) ?,Летние прически :) ?
Dragon quest monsters joker ds question please help?,"Dragon quest monsters joker ds вопрос, пожалуйста, помогите?"
my yahoo answers account even when i choose the answer as best it says the community voted it?,"мой аккаунт yahoo answers, даже когда я выбираю ответ как лучший, говорит о том, что сообщество проголосовало за него?"
Who do you like more Kobe or Dwayne?,"Кто тебе больше нравится, Коби или Дуэйн?"
Does Anyone Else Here Get Scared . . . ?,Кто-нибудь еще здесь боится...?
External DVD/rw drive problem in Nero 8?,Проблема с внешним приводом DVD/rw в Nero 8?
What does that suppose to mean?,"Что, по-твоему, это значит?"
If you mention someone on twitter in a message to others who is not your friend does that response show....?,"Если вы упоминаете кого-то в Твиттере в сообщении другим, кто не является вашим другом, отображается ли этот ответ ....?"
what is the best college for an engineering degree in M.I? in america?,какой колледж в Америке лучший для получения степени инженера в области M.I?
I would like an opinion of what u think?,"Я хотел бы услышать ваше мнение о том, что вы думаете?"
christains do you feel odd telling popele about gods love when................?,"кристен, тебе не кажется странным рассказывать попеле о божьей любви, когда................?"
How soon can you pierce your cartilage again? 10 POINTS TO THE BEST ANSWER & EVERYONE GETS A THUMBS UP!!!!!!!!?,Как скоро вы сможете снова проколоть свой хрящ? 10 БАЛЛОВ ЛУЧШЕМУ ОТВЕТУ И ВСЕ ПОЛУЧАЮТ ПОДНЯТЫЕ ВВЕРХ БОЛЬШИЕ ПАЛЬЦЫ!!!!!!!!!?
what is the song name on the geico commercial?,как называется песня в рекламном ролике geico?
is oxygen heavier/lighter than air?,является ли кислород тяжелее / легче воздуха?
OB/GYN in south florida who accepts medicaid and will see a patient who is high risk of high blood presure?,"АКУШЕР-ГИНЕКОЛОГ в южной Флориде, который принимает medicaid и примет пациента с высоким риском высокого кровяного давления?"
what french people eat (in french)?,что едят французы (по-французски)?
Michael Jackson Hotel Pillow?,Гостиничная подушка Майкла Джексона?
My dream is to be a Photographer?,Моя мечта - стать фотографом?
Seriously freaking out!! Can a freshman with no experience make girls JV soccer team?,Серьезно волнуюсь!! Может ли первокурсница без опыта попасть в женскую совместную футбольную команду?
"i have some questions about the book ""the giver""?","у меня есть несколько вопросов по книге ""Дающий""?"
Who has seen the anime Noir? If you want to answer...?,Кто видел аниме Нуар? Если вы хотите ответить...?
Egypt The word Rabena?,Что такое слово Рабена?
Where do hot teenage guys hang out in San Francisco?,Где в Сан-Франциско тусуются горячие парни-подростки?
Why do the Armed forces use 24-hour time and not 12-hour time?,"Почему Вооруженные силы используют 24-часовое время, а не 12-часовое?"
Do Libs understand Why this country was founded on the basic principal of Limited Government?,"Понимают ли либералы, почему эта страна была основана на основном принципе ограниченного правительства?"
Is a nintendo wii worth buying?,Стоит ли покупать nintendo wii?
Anyone hear about the mom auctioning off the right to name her baby on eBay?,"Кто-нибудь слышал о маме, выставляющей на аукцион право назвать своего ребенка на eBay?"
Would Eunice Kennedy Shriver's life been prolonged under Obamacare?,Продлилась бы жизнь Юнис Кеннеди Шрайвер в рамках программы Obamacare?
Should I call her or play it cool?,Должен ли я позвонить ей или вести себя спокойно?
where can i get an oversized BROWN tote or big messenger bag online except for ebay?,"где я могу купить негабаритную коричневую сумку-тоут или большую курьерскую сумку онлайн, кроме ebay?"
Why is this math so hard to figure out?,Почему в этой математике так трудно разобраться?
What are some really good movies from 2009?,Назовите несколько действительно хороших фильмов 2009 года?
is astrology the real 'religion'?,"является ли астрология настоящей ""религией""?"
My mom won't let me buy makeup?,Моя мама не разрешает мне покупать косметику?
Can common goldfish live with the fancies?,Может ли обычная золотая рыбка смириться с подобными фантазиями?
Nokia 6300 PUK code needed. Urgent help needed!?,Необходим PUK-код Nokia 6300. Нужна срочная помощь!?
is anybody excited for the cirque du freak movie?,"кто-нибудь в восторге от фильма ""Цирк уродов""?"
Where can I find the cheapest alpha black basic with e grip?,Где я могу найти самый дешевый alpha black basic с e grip?
Help! i have a science question for my homework idk its due tomorrow!?,"Помогите! у меня есть научный вопрос для моего домашнего задания idk, его нужно сдать завтра!?"
i want to get a bird But I have a question?,"я хочу поймать птицу, но у меня есть вопрос?"
How prestigious is the University of kingston?,Насколько престижен Кингстонский университет?
Is it ok to put mayo olive oil and avacodo in your hair?,Можно ли намазывать волосы оливковым маслом майонез и авакодо?
Is it safe to state that the majority of wars in the 21st Century have Muslims on one side of the conflict?,"Можно ли с уверенностью утверждать, что в большинстве войн 21 века мусульмане находятся на одной стороне конфликта?"
Is Doomsday 2012 really gonna happen?,Действительно ли случится Конец света 2012?
Why are people bringing loaded firearms to townhall meetings are they pushing buttons trying to pick a fight?,"Почему люди приносят заряженное огнестрельное оружие на собрания в ратуше, они нажимают на кнопки, пытаясь затеять драку?"
GIRLS what happened to casual dating?,"ДЕВОЧКИ, что случилось со случайными свиданиями?"
Atheists: Okay so I was in church today (a very rare occasion) and the guy was talking about?,"Атеисты: Хорошо, итак, я был сегодня в церкви (очень редкий случай), и парень говорил о?"
i just took my hpt maybe i was too anguish!?,"я только что принял свой hpt, может быть, я был слишком мучителен!?"
Does anybody else feel dizzy 24/7 and often feel as if they are going to frequently pass out?,"Кто-нибудь еще испытывает головокружение 24/7 и часто чувствует, что вот-вот потеряет сознание?"
Is it wrong to take a near two year old to McDonald's a couple of times a month?,Разве это неправильно - водить почти двухлетнего ребенка в McDonald's пару раз в месяц?
awkward immature flirting moments in class with a guy...(guys opinions prefered)?,неловкие моменты незрелого флирта в классе с парнем...(предпочтительны мнения парней)?
whre can i download wall e fastly and quickly without getting a premium account?,как я могу быстро скачать wall e без получения премиум-аккаунта?
how do you clean outside brass rail?,как вы чистите наружную латунную рейку?
I need some advice on a perfect movie?,Мне нужен совет по поводу идеального фильма?
How do I get my body  back after giving birth?,Как мне вернуть свое тело после родов?
factoring polynomials?,разложение многочленов на множители?
What is your ONE favourite full name for a boy and girl?,Какое ваше любимое полное имя для мальчика и девочки?
how do i remove a cif lemon  cream stain off my bed sheets  (they are cotton i think)?,"как мне удалить пятно от лимонного крема cif с моих простыней (по-моему, они хлопчатобумажные)?"
"what are the jobs of BE civil engineers ME structural engineers and BE+MBA (construction management)?""?","каковы рабочие места BE civil engineers, инженеров-строителей и BE+MBA (управление строительством)?""?"
isnt my mum being totally ungrateful?,разве моя мама не ведет себя совершенно неблагодарно?
Are you team Edward or team Jacob?,Вы команда Эдварда или команда Джейкоба?
Popular baby names from around the world - you like?,Популярные детские имена со всего мира - вам нравится?
Is it possible to view the Data from a HDD through USB?,Можно ли просмотреть данные с жесткого диска через USB?
Song or quote about moving on getting a fresh start breaking away (not breaking up) from something holding..?,"Песня или цитата о том, как двигаться дальше, начинать все сначала, отрываясь (не расставаясь) от чего-то, что удерживает..?"
What are your ocd rituals/ compulsions?,Каковы ваши ритуалы / принуждения при ОКР?
guys do u think this is creepy? honesttttt?,"ребята, вы думаете, это жутко? честностьтттт?"
"How would one say ""The Art of Design"" in Latin?","Как бы по-латыни сказать ""Искусство дизайна""?"
What's the difference between the Ti Nspire and the Ti Nspire CAS?,В чем разница между Ti Nspire и Ti Nspire CAS?
Something Is going on in my head and I can't exactly figure out what it is.?,"Что-то происходит у меня в голове, и я не могу точно понять, что это.?"
I have a A7V400MX asus motherboard i want to upgrade my RAM... Whats the biggest size i can use?,"У меня есть материнская плата asus A7V400MX, я хочу обновить свою оперативную память... Какой самый большой размер я могу использовать?"
I want to quit my job. Can I support my family and live on internet as a sole means of survival?,Я хочу уволиться со своей работы. Могу ли я содержать свою семью и жить в Интернете как единственном средстве выживания?
How do you make new friends?,Как вы заводите новых друзей?
Should drinking alcohol be banned in South Africa?,Следует ли запретить употребление алкоголя в Южной Африке?
what color do u mix with pink..to get yellow?,с каким цветом вы смешиваете pink..to стать желтым?
Free photo software to reduce exposure?,Бесплатное программное обеспечение для фотосъемки для уменьшения экспозиции?
I am growing tomatos in buckets and they are splitting open and have tough skins.What am I doing wrong?,"Я выращиваю помидоры в ведрах, и они раскалываются, и у них жесткая кожица.Что я делаю не так?"
Question about Japanese culture?,Вопрос о японской культуре?
Rat Gnawing His Fingers?,"Крыса, грызущая Его Пальцы?"
Where can you catch houndour in pokemon Soul Silver?,Где вы можете поймать хаундура в pokemon Soul Silver?
Dont people like this annoy you?,Разве такие люди тебя не раздражают?
I am looking for a translation from English to Scot gaelic?,Я ищу перевод с английского на шотландско-гэльский?
Find the slope of x + y = 7 ?,Найти наклон x + y = 7?
YuGiOh: Are Bakura's eyes blue or brown?,Юджио: У Бакуры глаза голубые или карие?
i 'm a new internet user.sometime Mozilla fire fox close its operation for security reason .what should i do?,я новый пользователь Интернета. когда-нибудь Mozilla fire fox закроет свою работу по соображениям безопасности.что я должен делать?
what is tampax -----------?,что такое тампакс -----------?
Im a little bit over weight and i was wondering...?,"Я немного прибавил в весе, и мне было интересно...?"
How do I put downloaded video clips onto my iPhone?,Как мне поместить загруженные видеоклипы на свой iPhone?
can i put any add ons besides PCIe 2 x 16?,"могу ли я установить какие-либо дополнения, кроме PCIe 2 x 16?"
What cosmetics do you suggest (MAC)?,Какую косметику вы предлагаете (MAC)?
when does the new season of inuyasha premiere?,"когда состоится премьера нового сезона ""инуяши""?"
How does it feel to have aborted your baby due to teenage pregnancy?,Каково это - сделать аборт своему ребенку из-за подростковой беременности?
How long do i have to wait to get an American Passport?,"Как долго мне нужно ждать, чтобы получить американский паспорт?"
There was something in my Processes called xbhno.exe any one know what it is?,"В моих процессах было что-то, называемое xbhno.exe кто-нибудь знает, что это такое?"
What is a good place to sell  used DVDs in Edmonton  Alberta?,"Какое хорошее место для продажи подержанных DVD-дисков в Эдмонтоне, Альберта?"
MY CHEST IS TIGHT AND I CANT BREATHE WHAT DO I DO?,"У МЕНЯ СДАВИЛО ГРУДЬ, И Я НЕ МОГУ ДЫШАТЬ, ЧТО МНЕ ДЕЛАТЬ?"
From this picture....?,С этой фотографии....?
Girls would you date a guy?,"Девочки, вы бы стали встречаться с парнем?"
does lemon juce get rid of athlete's foot?,помогает ли лимонный сок избавиться от стопы спортсмена?
my computer will not recognize my iPhone anymore?,мой компьютер больше не распознает мой iPhone?
oil pump on my d16y8 Help?! Please?,масляный насос на моем d16y8 поможет?! Пожалуйста?
is there a way to decaffeinate a caffeinated tea bag?,есть ли способ обеззаразить чайный пакетик с кофеином?
moving out contract. unsure if I can move out with 28 days notice or I must stay til end of lease. Please help?,"расторгающий контракт. не уверен, могу ли я съехать с уведомлением за 28 дней или я должен остаться до окончания срока аренды. Пожалуйста, помогите?"
Is there any way that you can make screens on the patio so you can see out and no one can see in?,"Есть ли какой-нибудь способ сделать ширмы во внутреннем дворике, чтобы вы могли видеть снаружи, а никто не мог заглянуть внутрь?"
geometry a paralleogram is always or never a square?,геометрия параллелограмм всегда или никогда не является квадратом?
How clear would a Blu-Ray DVD player be on a 37 inch 1080i HDTV?,Насколько четким будет воспроизведение Blu-Ray DVD на 37-дюймовом HDTV с разрешением 1080i?
how do i relate populism to wizard of oz?,"как я соотношу популизм с ""волшебником страны Оз""?"
Who filmed Neil Armstrong's first step on the moon?,"Кто снимал ""Первый шаг Нила Армстронга на Луну""?"
Anybody who can help me with physics?,"Кто-нибудь, кто может помочь мне с физикой?"
Are ther any athiest women on dating websites as all I find are religious ones who wont date an athiest?,"Есть ли какие-нибудь самые атеистичные женщины на сайтах знакомств, поскольку все, что я нахожу, - это религиозные женщины, которые не будут встречаться с самыми атеистичными?"
I Need help with jigsaw costume?,Мне нужна помощь с костюмом паззла?
what is the meaning of proverbs 9:6?,в чем смысл притчей 9:6?
I'm moving will it ruin my relationship?,"Я переезжаю, разрушит ли это мои отношения?"
Why is Hillary nowhere to be seen or heard on Afghanistan or 0bamacare?,Почему Хиллари нигде не видно и не слышно по Афганистану или 0bamacare?
My resume is 3 pages - all with pertinent info.  Is this too long?  Will the person hiring really read it?,"Мое резюме состоит из 3 страниц - все с соответствующей информацией.  Это слишком долго?  Действительно ли человек, принимающий на работу, прочитает это?"
remember how in stephen king's carrie she...?,"помните, как в ""Кэрри"" Стивена Кинга она...?"
what's the meaning of 'celebs'?,"что означает слово ""знаменитости""?"
Is there more to the purpose of God in saving manOR is saving man the means through which the purpose of God?,"Есть ли что-то большее в Божьей цели спасения человека или спасение человека - это средство, с помощью которого достигается Божья цель?"
Gas companies and car companies?,Газовые компании и автомобильные компании?
Im 16 and have muscle twitching?,"Мне 16, и у меня подергиваются мышцы?"
How to get a black faded hat back to original color?,Как вернуть черной выцветшей шляпе первоначальный цвет?
Teens: What is your favourite song right now?,Подростки: Какая ваша любимая песня прямо сейчас?
How do i get started on publishing?,Как мне приступить к публикации?
best place to buy cheap anime?,"лучшее место, где можно купить дешевое аниме?"
I need dessert and wine suggestions....?,Мне нужны предложения по десерту и вину....?
TV brandwhich is better element or phillips?,"Телевизионный бренд, который лучше element или phillips?"
How do I shorten a song?,Как мне сократить песню?
