en,ru
Why hasn't there been any violence and looting in Manchester?,Почему в Манчестере не было никакого насилия и мародерства?
How can I get my friend's husband to love me?,Как я могу заставить мужа моей подруги полюбить меня?
Is it always sunny in Heaven?,Всегда ли на небесах солнечно?
contracting parasitic infections?,заражение паразитарными инфекциями?
"What is ""intrinsic medical renal disease""?","Что такое ""врожденное медицинское заболевание почек""?"
Could i gain residency in a state while working to file taxes and go to a school online from another state?,"Могу ли я получить вид на жительство в штате, работая над подачей налогов и посещая школу онлайн из другого штата?"
is this adult bullying?,это издевательство над взрослыми?
How do you teach yourself a forgein language?,Как вы сами учите иностранный язык?
Do you think remembering past lives is possible? ?,"Как вы думаете, возможно ли вспоминать прошлые жизни? ?"
Anyone know where I can find a BCT s800 tire?,"Кто-нибудь знает, где я могу найти шину BCT s800?"
will obama win the 2012 re-election?,победит ли Обама на переизбрании в 2012 году?
Do you think Indians opening partnership will be greater than 60?,"Как вы думаете, число вступающих в партнерство индийцев превысит 60?"
question about getting my swole on (abbs/core workouts)?,"вопрос о том, как включить мой swole (abbs / основные тренировки)?"
Does Megan Fox have a Twitter?,Есть ли у Меган Фокс Твиттер?
Is The Movie Hostel Grusome?,Является ли Кино-хостел скучным?
Are these statements correct?,Верны ли эти утверждения?
What Tattoo Of Greek Mythology Character Would You Get?,Какую Татуировку Персонажа Греческой Мифологии Вы Бы Сделали?
am i weird cause i sing in the shower?,"я странный, потому что пою в душе?"
Preparing my dog...please help...?,"Готовлю мою собаку... пожалуйста, помогите...?"
Why did They create this habitat for us? Why are They maintaining it? Are They studying us?,Почему они создали для нас эту среду обитания? Почему они поддерживают это? Они изучают нас?
Ever heard of this plot before?,Когда-нибудь слышали об этом заговоре раньше?
difference between these??/?,разница между этими??/?
could they be wrong on my ultrasound?,могли ли они ошибиться на моем УЗИ?
Do interior designers make good money?,Хорошо ли зарабатывают дизайнеры интерьеров?
If a man understood the point of his life but it's too late who is he?,"Если человек понял смысл своей жизни, но слишком поздно, кто он такой?"
Do Korean Idols that don't come from South Korea have to be in the military?,"Обязательно ли корейским кумирам, которые не родом из Южной Кореи, служить в армии?"
does anyone know what number airbus czech airlines use to travel to crete from dublin flight num hcc6528?,"кто-нибудь знает, какой номер использует airbus czech airlines для перелета на Крит из Дублина рейсом num hcc6528?"
Is 10dollarmall.com a real site?,Является 10dollarmall.com реальный сайт?
Legal rights a quick question?,Юридические права небольшой вопрос?
Can my Blaiziken still spread Poke`Rus?,Может ли мой Блейзикен по-прежнему распространять Poke'Rus?
What are healthy ways to lose belly fat fast?,Каковы здоровые способы быстро избавиться от жира на животе?
How to get a key fob for a 98 honda civic?,Как получить брелок для ключей honda civic 98 года выпуска?
LGBT~What would you do if you got sent to straight camp?,"ЛГБТ ~ Что бы ты сделал, если бы тебя отправили в лагерь для натуралов?"
I am currently on the 02 network and want to change my number is it possible?,"В настоящее время я нахожусь в сети 02 и хочу сменить свой номер, возможно ли это?"
Am I too small to carry my baby to term?,"Я слишком мала, чтобы выносить своего ребенка до срока?"
I WANT TO MAKE MY ID?,Я ХОЧУ СДЕЛАТЬ СВОЕ УДОСТОВЕРЕНИЕ ЛИЧНОСТИ?
How to do taylor Swift make up for school?,Как сделать Тейлор Свифт макияж для школы?
Ok I need a little help with testing this girl?,"Хорошо, мне нужна небольшая помощь с тестированием этой девушки?"
I have an African American buddy....?,У меня есть приятель-афроамериканец....?
Sugarpaste Regalice in London?,Королевское блюдо из сахарной пасты в Лондоне?
DeAngelo Williams or Willis McGahee (with Moreno out) this week in Fantasy?,Деанджело Уильямс или Уиллис Макгахи (без Морено) на этой неделе в Fantasy?
Who find pro life women prettier than pro choice women? Why?,"Кто считает женщин pro life красивее, чем женщин pro choice? Почему?"
travailing for anther place?,мучаешься из-за другого места?
Ex vs. Me - I need to know what is right. What should I expect?,"Бывший против меня - мне нужно знать, что правильно. Чего мне следует ожидать?"
how many 5 digit numbers are there that include the digit 5 and exclude the digit 8?,"сколько существует 5-значных чисел, которые включают цифру 5 и исключают цифру 8?"
Comparisons of Captain of industry and robber barons?,Сравнения капитана промышленности и баронов-разбойников?
How to gain serotonin!!?,Как получить серотонин!!?
The blockage in my throat has persisted for almost a month now. Im a little concerned. Any suggestions?,Закупорка в моем горле сохраняется уже почти месяц. Я немного обеспокоен. Есть какие-нибудь предложения?
Rape question....... ?,Вопрос об изнасиловании....... ?
Is the Army in need of people?,Нуждается ли армия в людях?
What does (excuse the spelling) i shall write it as it sounds : say la via say la va mean . please ?,"Что означает (извините за орфографию), я напишу это так, как это звучит: скажи ла через скажи ла ва. пожалуйста?"
what are the hollywood undead members real names?,каковы настоящие имена участников hollywood undead?
Why isn't my penis growing?,Почему мой пенис не растет?
Where would I get Bose MIE2 headphone cheap ?,Где бы я мог дешево купить наушники Bose MIE2?
How do I get my ghost to appear on the sims 3?,Как мне заставить своего призрака появиться в the sims 3?
Guys does this guy like me or not?,"Ребята, я нравлюсь этому парню или нет?"
Why does our culture wake up so early?,Почему наша культура просыпается так рано?
i have this code could somebody please help?,"у меня есть этот код, не мог бы кто-нибудь, пожалуйста, помочь?"
Are things fate or merely coincidence?,Что это - судьба или просто совпадение?
1099 c form misplaced filing questions report?,форма 1099 c отчет о неуместных вопросах подачи?
Calculate the change in internal energy for a system that absorbs 256J of heat and does 160J of work on the su?,"Рассчитайте изменение внутренней энергии для системы, которая поглощает 256 Дж тепла и выполняет 160 Дж работы на su?"
RHH: Common Or Andre 3000?,RHH: Обычный или Andre 3000?
How do I suspend someone on Youtube?,Как мне приостановить работу кого-либо на Youtube?
if the occupy crowds win...will our government be even MORE liberal?,"если победят толпы ""оккупай""...будет ли наше правительство еще более либеральным?"
How do I Not activate IOS 5 on Ipone 4?,Как мне не активировать IOS 5 на Ipone 4?
How come for Halloween grown women like to dress slutty?,Почему на Хэллоуин взрослым женщинам нравится одеваться распутно?
My yahoo bookmarks disappeared yesterday. I can get in to yahoo pages but cannot install yahoo toolbar.?,"Мои закладки yahoo исчезли вчера. Я могу зайти на страницы yahoo, но не могу установить панель инструментов yahoo.?"
WHAT DOES HERPES MEAN !??????????,ЧТО ЗНАЧИТ ГЕРПЕС!??????????
In hot/dry environment water in a swimming pool must be replenished regularly what is happen to missing water?,В жаркой / сухой среде воду в бассейне необходимо регулярно пополнять. Что происходит с недостающей водой?
what's the heat of reaction for C2H4(g) + 6HCl(g) -> 2CHCl3(G) +4H2(g) given these (HESS'S LAW?)?,"какова теплота реакции для C2H4(g) + 6HCl(g) -> 2CHCl3(G) + 4H2(g), учитывая это (ЗАКОН ГЕССА?)?"
Is it ok to ask a girl out on a date if your not completley sure she likes you back?,"Нормально ли приглашать девушку на свидание, если ты не совсем уверен, что нравишься ей в ответ?"
Lady's what do you think of a Guy dressing as a LadyBug?,"Леди, что вы думаете о парне, наряжающемся Божьей коровкой?"
How can i take off nail polish with nail varnish remover?,Как я могу снять лак с ногтей с помощью жидкости для снятия лака?
lookin 4 good teen craft websites?!?,ищете 4 хороших сайта для подростков?!?
Why does my CSS code not work?,Почему мой CSS-код не работает?
How would I write the slope of line that is parallel and perpendicular to Y=4/3x - 1 ?,"Как бы я записал наклон линии, параллельной и перпендикулярной Y =4/ 3x - 1?"
how can i be a good sprinter and a long distance runner at the same time?,как я могу быть хорошим спринтером и бегуном на длинные дистанции одновременно?
What do I do if my best friend and I like the same guy... And he likes us both equally?,"Что мне делать, если нам с моей лучшей подругой нравится один и тот же парень?.. И мы оба нравимся ему одинаково?"
How to tease a guy (casually)?,Как подразнить парня (небрежно)?
how can i sort out this problem before tommorow (really urgent)?,как я могу решить эту проблему до завтра (действительно срочно)?
: How many acres to make a mile? Alright I want to know how much rural desert land this is.?,": Сколько акров нужно, чтобы получилась миля? Хорошо, я хочу знать, сколько здесь сельской пустынной земли.?"
My dog's penis has been out for 5 hours. Is this a serious problem?,Пенис моей собаки отсутствовал уже 5 часов. Является ли это серьезной проблемой?
Can anyone assist me with some basic Spreadsheet & Databases questions?,Кто-нибудь может помочь мне с некоторыми базовыми вопросами по электронным таблицам и базам данных?
How do I tell her how I feel?,"Как мне сказать ей, что я чувствую?"
Chemistry problem! help please!?,"Проблема с химией! помогите, пожалуйста!?"
what has western style dresses to do with truancy in east?,какое отношение платья в западном стиле имеют к прогулам на востоке?
Nightmare Before Christmas Blu-Ray?,"Blu-Ray ""Кошмар перед Рождеством""?"
Where can aniracetam be purchased as far as stores?,Где можно приобрести анирацетам в магазинах?
How can I partition my C drive space without formating it in XP?,"Как я могу разделить свое пространство на диске C, не форматируя его в XP?"
Ladies where would you most rather be into meet a guy?,"Дамы, где бы вы больше всего хотели познакомиться с парнем?"
A 40.0 marble moving at 2.30 strikes a 22.0 marble at rest. What is the speed?,"Шарик 40,0, движущийся со скоростью 2,30, ударяется о шарик 22,0, находящийся в состоянии покоя. Какова скорость?"
Where are the JROTC programs in Illinois?,Где находятся программы JROTC в Иллинойсе?
what do you do when you have trouble sleeping?,"что вы делаете, когда у вас проблемы со сном?"
My Car is overheating......?,Моя машина перегревается......?
i took a pill to start my periods but still not started what should i do...hepl...!!!?,"я приняла таблетку, чтобы начать месячные, но они все еще не начались, что мне делать... гепл...!!!?"
What are some new (2009-2011) songs i could sing for my talent show?,Какие новые песни (2009-2011) я мог бы спеть для своего шоу талантов?
Passport in a hurry........ Is dat possible in India????????????????????????????????????????????????////?,Паспорт в спешке........ Возможно ли это в Индии????????????????????????????????????????????????////?
why dose my eyeball hurt a lot ?,почему у меня так сильно болит глазное яблоко?
how long would you spend at pizza hut?,сколько времени вы бы провели в pizza hut?
accessories that go with this gray dress?,"аксессуары, которые сочетаются с этим серым платьем?"
How much do they screen/investigate parents who volunteer in the school?,"Как часто они проверяют родителей, которые добровольно работают в школе?"
How much oil does an BlueMax Chain saw 45cc use?,Сколько масла расходует цепная пила BlueMax 45cc?
How to add a bbm contact to homescreen on my blackberry curve ?,Как добавить контакт bbm на рабочий стол моего blackberry curve?
"how to say ""has been increasing"" in spanish?","как сказать ""растет"" по-испански?"
Son being 'bullied'. What do we do? Can some one who knows law help?,"Сын, над которым ""издеваются"". Что нам делать? Может ли кто-нибудь, кто разбирается в юриспруденции, помочь?"
"How do I say "" Have a drink for me in Germay?""?","Как мне сказать ""Выпей за меня в Германии""??"
is this too dorky of a gift for a man?,не слишком ли дурацкий подарок для мужчины?
One pec is bigger than the other?,Один уик больше другого?
Could i be pregnant??!!?,Могу ли я быть беременна??!!?
Have you ever gained trust in boy or girlfriend after they lied to you?,"Вы когда-нибудь завоевывали доверие к парню или девушке после того, как они лгали вам?"
does a eukaryotic cell have a flagella/cilia?,есть ли у эукариотической клетки жгутики/ реснички?
In all honesty do Lions fans really think the Lions will make the playoffs?,"Честно говоря, действительно ли фанаты ""Лайонз"" думают, что ""Лайонз"" выйдут в плей-офф?"
i cheated on my ex his birthday is tmr should i say happy birthday?,"я изменила своему бывшему, у него день рождения в пмр, должна ли я поздравить его с днем рождения?"
I got a job but my father said to play in his band drink car urine and attend burning cross rituals?,"Я устроился на работу, но мой отец сказал, чтобы я играл в его группе, пил автомобильную мочу и посещал ритуалы сожжения креста?"
Did my parents get me this for Christmas?,Мои родители подарили мне это на Рождество?
Still terrified of stupid crap?,Все еще боишься глупого дерьма?
Should the Arab League sanction the 3 Wise Men for gold inciense and myrrh trafficking?,Должна ли Лига арабских государств наложить санкции на трех мудрецов за торговлю золотыми благовониями и миррой?
Will Ron Paul be our next president?,Будет ли Рон Пол нашим следующим президентом?
If you wanted engraved chopsticks for yourselfwhat would you engrave on them?,"Если бы вы хотели себе палочки для еды с гравировкой, что бы вы выгравировали на них?"
I made the biggest mistake of my life... I'm too nice?,Я совершил самую большую ошибку в своей жизни... Я слишком мил?
Help! Hair lose need suggestions?,Помогите! Выпадение волос нужны предложения?
How to reduce lag on Adventure Quest Worlds?,Как уменьшить отставание в мирах приключенческих квестов?
would ther be a problem changing medseffexor to prozac uk?,возникнут ли проблемы с заменой medseffexor на prozac uk?
I have not paid my Second mortgage in 6 months...I owe 700k on first and pay on time.. Iowe 100k on 2nd....?,Я не выплатил свою вторую ипотеку за 6 месяцев...Сначала я должен 700 тысяч и плачу вовремя.. Iowe 100k на 2-м....?
Is it possible to scare yourself into thinkinf you pregnant and developing pregnant like symptoms?,"Возможно ли напугать себя мыслью о том, что вы беременны, и у вас развиваются симптомы, похожие на беременность?"
What is the answer for this geometry question?,Каков ответ на этот геометрический вопрос?
girls what do you think?,"девочки, что вы думаете?"
Advice on marriage and porn?,Советы по поводу брака и порнографии?
What matches with red shoes? supra skytops?,Что сочетается с красными туфлями? надземные вершины?
i have a school project on stalking and i need some good quotes and sayings slogans?,"у меня школьный проект по сталкингу, и мне нужно несколько хороших цитат и высказываний-лозунгов?"
Why wont my bearded dragon eat?,Почему мой бородатый дракон не ест?
What does it mean when he kissed me back on my cheek?????? Please read and help me out.?,"Что это значит, когда он поцеловал меня в ответ в щеку?????? Пожалуйста, прочтите и помогите мне.?"
3D Origami Plzz help :)?,"3D Оригами, пожалуйста, помогите :)?"
Got a game against a REALLY good team and i really havent been doing so well any goalie tips?,"Предстоит игра против ДЕЙСТВИТЕЛЬНО хорошей команды, и у меня действительно не так хорошо получаются какие-нибудь советы вратарю?"
Girls: I new help picking a color dress for a pageant? ?,Девочки: Мне нужна помощь в выборе цвета платья для конкурса красоты? ?
how to keep baby bunnies alive?,как сохранить жизнь детенышам кроликов?
draw a diagram to show how many 3/4 feet pieces of string can be cut from a piece of string 4 1/2 feet long?,"нарисуйте диаграмму, чтобы показать, сколько кусочков бечевки длиной 3/4 фута можно отрезать от куска бечевки длиной 4 1/2 фута?"
After you delete photo's from your camera is it possible to find them some how?,"После того, как вы удалите фотографии со своей камеры, возможно ли их как-нибудь найти?"
I have to wait for an update to get English back on my Mac?,"Я должен ждать обновления, чтобы вернуть английский на мой Mac?"
I cannot study! Please Help!?,"Я не могу учиться! Пожалуйста, помогите!?"
motivate my brother to become better at hockey?,мотивировать моего брата становиться лучше в хоккее?
Geometry HW Help PLEASE RESPOND QUICKLY?,"Геометрия HW Помощь, ПОЖАЛУЙСТА, ОТВЕТЬТЕ БЫСТРО?"
good occupation for me?,хорошее занятие для меня?
Is it OK to participate in my gym class while doing a 24 hour fast?,Можно ли посещать мои занятия в тренажерном зале во время 24-часового голодания?
Getting into MTG any advise?,"Как попасть в MTG, есть какие-нибудь советы?"
Need name for clothing line?,Нужно название для линии одежды?
should i go to a indoor shooting range?,должен ли я пойти на стрельбище в помещении?
Im confused about a girl pls help?,"Я запутался в девушке, пожалуйста, помогите?"
whats a good hook for my albert einstein essay???10 points for best essay?,какая хорошая зацепка для моего эссе об Альберте Эйнштейне??? 10 баллов за лучшее эссе?
PLEASE HELP ME IS THIS NORMAL WITH A C SECTION??? IM WORRIED?,"ПОЖАЛУЙСТА, ПОМОГИТЕ МНЕ, ЭТО НОРМАЛЬНО ПРИ КЕСАРЕВОМ СЕЧЕНИИ??? Я ВОЛНУЮСЬ?"
what are the specific examples of variation within species?,каковы конкретные примеры вариации внутри вида?
Flying for the first time on a Jet?,Впервые летите на реактивном самолете?
Will my 3 sim card work in a phone that usually uses an o2 sim card?,"Будет ли моя 3-sim-карта работать в телефоне, который обычно использует o2 sim-карту?"
Can your please help me with this please:)??for school(poem)?,"Не могли бы вы, пожалуйста, помочь мне с этим, пожалуйста :)?? для школы (стихотворение)?"
what type of doctor specialized in height?,какой тип врача специализировался на росте?
Frequent fatigue  dizziness ?,Частая усталость головокружение?
Why did my professor snap at me when I asked her where she was interviewing?,"Почему мой профессор набросилась на меня, когда я спросил ее, где у нее собеседование?"
i have a eating something healthy phobia something???HELP?,"у меня есть фобия есть что-то полезное, что-то???ПОМОГИТЕ?"
